unit_id,unit_title,lesson_id,lesson_title,lesson_activity,lesson_activity_name,lesson_notes,lesson_video_id,lesson_objectives
1,SQLite,1,SQLite Overview,yes,Questions,https://docs.google.com/presentation/d/1owF0wNA1BPjzZ6TSvEULaZmM_2UTHN3GY4L3nzYND90,SUv99Xa0iIw,"<ul><li>In this lesson, you'll learn what SQLite is, the idea of ContentValues and Cursors, and some basic SQLite commands.</li></ul>"
1,SQLite,2,Project Setup,,,https://docs.google.com/presentation/d/1owF0wNA1BPjzZ6TSvEULaZmM_2UTHN3GY4L3nzYND90,J_bWdraYiy4,"<ul><li>In this lesson, you'll download and see what you have for the starting code for this unit's example.</li></ul>"
1,SQLite,3,Creating the Database,yes,Questions,https://docs.google.com/presentation/d/1owF0wNA1BPjzZ6TSvEULaZmM_2UTHN3GY4L3nzYND90,nWOPJ_9BWwE,"<ul><li>In this lesson, you'll learn how to subclass the SQLiteOpenHelper class to create your database.</li></ul>"
1,SQLite,4,Adding an Item,yes,Questions,https://docs.google.com/presentation/d/1owF0wNA1BPjzZ6TSvEULaZmM_2UTHN3GY4L3nzYND90,P2IPWoZsUlo,"<ul><li>In this lesson, you'll learn how to use ContentValues to add a new item to the database.</li></ul>"
1,SQLite,5,Querying for Items,yes,Questions,https://docs.google.com/presentation/d/1owF0wNA1BPjzZ6TSvEULaZmM_2UTHN3GY4L3nzYND90,jPPOUFvcocU,"<ul><li>In this lesson, you'll learn how to write a query to get all items from the database.</li><li>You'll also learn how to create a CursorAdapter to display the info in that Cursor in a ListView.</li></ul>"
1,SQLite,6,Updating an Item,yes,Questions,https://docs.google.com/presentation/d/1owF0wNA1BPjzZ6TSvEULaZmM_2UTHN3GY4L3nzYND90,Lvy7zUjkc4Y,"<ul><li>In this lesson, you'll learn how to update an item in the database. </li><li>You'll also learn how to query the database for a single item.</li></ul>"
1,SQLite,7,Deleting an Item,yes,Questions,https://docs.google.com/presentation/d/1owF0wNA1BPjzZ6TSvEULaZmM_2UTHN3GY4L3nzYND90,d7xEvG9QWCs,"<ul><li>In this lesson, you'll learn how to delete an item or items from the database.</li></ul>"
1,SQLite,8,Lab: Rose Homework Using SQLite,,,https://docs.google.com/presentation/d/1owF0wNA1BPjzZ6TSvEULaZmM_2UTHN3GY4L3nzYND90,zp771pWIHyI,"<ul><li>The lab specification is <a href='https://docs.google.com/document/d/1iJQCX6Z1skhfBIuNKoPv6JcPB0gKHENjfehxizBk6Bo' target='_blank'>here</a>.</li><li>When done, be sure to submit your zipped Eclipse project (Rose Homework), plus video demo, to the Moodle dropbox.</li><li>Then go complete the Moodle 'SQLite' self-evaluation survey before calling it a day.</li></ul>"
